Nama_Produk,Harga
"Laptop Acer Aspire Go 14 Intel Core 5 120U RAm 8 GB / 16 Gb SSD 1 TB Windows 11 + Office Home Stundent 14"" WUXGA IPS",8649000
"Laptop Advan 360 Stylus Pro AMD Ryzen 5 7430U RAM 8 GB SSD 512 GB Windows 11 14"" WUXGA touch Screen 2in1",6949000
"Laptop Advan Workplus Air OLED AMD Ryzen 5 7535HS RAM 16 GB SSD 512 GB Windows 11 14"" WUXGA 1.1 Kg",8549000
Laptop Acer Aspire 7 Pro A715 Intel COre i5 13420H GeForce RTX 3050 6GB RAM 8GB SSD 512 GB Windows 11 + Office Home Student 15.6 FHD 144Hz,10599000
"All in One PC Desktop Axioo AIO Hype Flex 5+ MAX Intel COre i5 12600H RAM 8 / 16 GB SSD 256 / 512 GB DOS / Windows 11 27"" Full HD IPS",8299000
All In One PC Desktop Axioo AIO Hype Flex 3+ Intel Core I3 1220P RAM 8 GB SSD 256 GB DOS / Windows 11 23.8 Full HD IPS,6599000
Acer PC Desktop TCX Intel Core i5 14400 H610 RAM 8 GB SSD 512 GB Windows 11 + Office Home Student + Monitor LED 21.5 Inch Full HD,10349000
Acer PC Desktop TCX Intel Core i3 14100 H610 RAM 8 GB SSD 512 GB Windows 11 + Office Home Student + Monitor LED 21.5 Inch Full HD,8649000
PC Desktop All In One ASUS AIO V440VAK Intel Core I5 13420H RAm 16 GB SSD 1 TB Windows 11 + Office Home Student 23.8 Full HD,11199000
"ASUS All In One PC Desktop AIO P470VAT Touch Screen Intel Core i7 13620H RAM 16 GB SSD 512 GB WIndows 11 + Office Home Student 27"" Full HD",16749000
"ASUS All In One PC Desktop AIO P470VAK Intel Core i5 13420H RAM 8 GB SSD 512 GB WIndows 11 + Office Home Student 27"" Full HD",10449000
"ASUS All In One PC Desktop AIO P440VAT Touch Screen Intel Core i5 13420H RAM 16 GB SSD 512 GB WIndows 11 + Office Home Student 23.8"" Full HD",11849000
"ASUS All In One PC Desktop AIO P440VAK Intel COre i7 13620H RAM 8 / 16 GB SSD 512 GB WIndows 11 + Office Home Student 23.8"" Full HD",13399000
"ASUS All In One PC Desktop AIO P440VAK Intel COre i5 13420H RAM 8 GB / 16 GB SSD 512 GB WIndows 11 + Office Home Student 23.8"" Full HD",9749000
"ASUS All In One PC Desktop AIO P440VAK Intel COre i3 1315 RAM 8 GB SSD 512 GB WIndows 11 23.8"" Full HD White Seris",7599000
"PC Desktop All in One Advan AIO Force One A24A R56s1 AMD Ryzen 5 6600H RAM 8 GB SSD 512 GB WINDOWS 11 23.8"" FULL HD",6499000
"PC Desktip All In One Acer AIO ACX24 Intel Core i5 12450H RAM 8 GB SSD 512 GB Windows 11 + Office Home Student 23.8"" Full HD IPS",9699000
"PC Desktip All In One Acer AIO ACX24 Intel Core i3 1215 RAM 8 GB SSD 512 GB Windows 11 + Office Home Student 23.8"" Full HD IPS",7599000
"Laptop Axioo Pongo 765 Intel Core I7 13620H GeForce RTX 5060 8 GB RAm 16 GB SSD 512 GB Windows 11 / DOS 16"" WUXGA 165 Hz 100 Srgb",18549000
APPLE IPHONE AIR 256 GB / 512 GB GARANSI RESMI INDONESIA,19899000
"Laptop Axioo Hype-R X8 OLED AMD Ryzen 7 6850 RAM 16 gb SSD 512 GB Windows 11 14"" Full HD IPS Under 1 kg",9999000
All In One PC Desktop ACER AIO Aspire C24 195ES Intel Core Ultra 5 125U RAM 8 GB SSD 512 GB Windows 11 + Office Home Student 23.8 Full HD,10599000
"All In One PC Desktip Acer AIO Aspire C22 1800 Intel Core i5 13420H RAM 8 GB SSD 512 GB Windows 11 + Office Home Student 21.5"" Full HD",8999000
Laptop MSI Katana 15HX Intel Core i7 14650HX GeForce RTX 5070 8GB RAM 32 GB SSD 1 TB Windows 11 + Office Home Student 15.6 FHD 144HZ 2 Year,23999000
GIGABYTE GAMING MONITOR 25 INCH SS IPS FHD 1080P 1MS 240HZ / 200HZ GS25F2A HDR10 TILT 3Y,1599000
HP DESKJET INK ADVANTAGE 2875 GARANSI RESMI,1089000
ASUS ROG XBOX ALLY AMD RYZEN Z2 A 16GB 512GB W11 7.0FHD 120HZ WHITE,9949000
"Laptop Acer Aspire Lite 14 AL14 Intel Celeron N150 RAM 8 GB SSD 256 GB Windows 11 + Office Home Student 14"" Full HD IPS",5019000
LENOVO LEGION GO S 2025 AMD Z1 EXTREME 32GB 1TB W11 8.0WUXGA TOUCH 120HZ 100SRGB 1Y WHITE,12899000
"Laptop ASUS Vivobook 14 A1404VAP Intel Core 5 120U RAM 8 GB SSD 512 GB Windows 11 + Office Home Student 14"" Full HD VIPS",8399000
"Laptop HP 14 Intel Core Ultra 7 155H RAM 16 GB SSD 512 GB Windows 11 + Office Home Student 14"" Full HD IPS",11599000
"Laptop ASUS Gaming V16 V3607VJ Intel COre 5 210 H GeForce RTX 3050 6GB RAM 8 GB SSD 512 GB Windows 11 + Office Home Student 16"" WUXGA 144Hz",11799000
"Laptop Lenovo Legion Pro 5 16 OLED AMD Ryzen 7 8745HX GeForce RTX 5060 8 GB RAM 24 GB SSD 1 TB Windows 11 + Office Home Student 165Hz 16"" WQXGA",26299000
Laptop Lenovo Ideapad SLim 3 14 AMD Ryzen 5 7520 RAM 16 GB SSD 512 GB WIndows 11 + Office  Home Student,7649000
"Laptop Avita Pura A+ AMD Ryzen 5 5500 RAm 8 GB SSD 512 GB Windows 11 14"" FUll HD",5299000
"Laptop Avita Pura A+ Intel Core I5 1235 RAm 8 GB SSD 512 GB Windows 11 14"" FUll HD",5749000
"Laptop Avita Pura A+ Intel Core I3 1215 RAm 8 GB SSD 256 GB Windows 11 14"" FUll HD",4399000
LENOVO IDEACENTRE TOWER INTEL CORE I5 14400 RAM 8GB SSD 512GB Windows 11 + MONITOR 21.5,10499000
LENOVO IDEACENTRE TOWER INTEL CORE I5 13400 RAM 8GB SSD 512GB Windows 11+OHS + MONITOR 21.5,10499000
"Laptop HP 14 Intel COre 5 120U RAM 16 GB SSD 512 GB Windows 11 + Office Home Student 14"" Full HD",8899000
ASUS AIRVISION M1 SMART GLASSES GARANSI RESMI,6249000
MSI MONITOR MODERN MD2412P IPS FHD 100HZ ERGONOMIC SPEAKER USB C 3Y GARANSI RESMI,1679000
Laptop Acer Predator Helios Neo 16 AI Intel COre Ultra 9 275HX GeForce RTX 5070TI 12 GB RAM 32 GB SSD 1 TB Windows 11 + Office,38099000
"Laptop HP Omnibook 5 AI 16 Intel Core Ultra 5 225 RAM 16 GB SSD 1 Tb Windows 11 + Office Home Student 16"" 2K",13999000
Laptop HP Omnibook 7 AERO 13 AMD Ryzen AI 7 350 RAM 16 GB SSD 512 GB Windows 11 + Office Home Student 13.3 WQXGA IPS,15249000
XIAOMI SMART PROJECTOR L1 PRO EU GARANSI RESMI,3979000
"Laptop Acer Swift Lite 14 SFL14 AMD Ryzen 5 240 RAM 16 GB SSD 512 GB Windows 11 + Office Home Student 14"" WUXGA IPS",11399000
"Laptop Advan Workplus AMD Ryzen 7 7735HS RAM 16 GB SSD 512 GB Windows 11 14"" Full HD UPS",8099000
LG MONITOR 24 INCH 24U411A-B IPS FHD 1080P 1MS HDR 10 120HZ 4 SIDE BORDERLESS 3Y,1289000
"Laptop MSI Modern 14 Intel COre I3 1315U RAM 8 GB SSD 512 gb Windows 14""  Full HD",5899000
Laptop Lenovo LOQ 15 AMD Ryzen 5 220 GeForce RTX 5050 8 GB RAM 16 GB SSD 512 GB Windows 11 + Office Home Student 15.6 Full HD 144 Hz 100 Srgb,16699000
Laptop Lenovo LOQ 15 AMD Ryzen 7 250 GeForce RTX 5050 8 GB RAM 16 GB SSD 512 GB Windows 11 + Office Home Student 15.6 Full HD 144 Hz 100 Srgb,18699000
PC Desktop All in One LENOVO AIO IDEACENTRE 24 INTEL CORE I5 13420H RAM 8GB SSD 1 TB W11+OHS 23.8 Full HD,10799000
"Laptop Acer Aspire Lite 14 AL14 Core 3 N355 RAM 8GB SSD 512 GB Windows 11 + Office Home Student 14"" inch FHD IPS",6049000
"Laptop Lenovo Ideapad Slim 5 14 OLED AMD Ryzen AI 7 350 RAM 16 GB SSD 512 GB Windows 11 + Office Home Student 14"" WUXGA",13399000
LG SMART MONITOR 32 INCH 32U889SA-W IPS 4K 2160P 5MS 60HZ USB-C TOUCH SCREEN ROLLING STAND SPEAKER ERGONOMIC WEBOS WHITE 3Y,13499000
Laptop ASUS Vivobook A1405VA Intel Core i5 13420H RAM 16 GB SSD 512 GB Windows 11 + Office HOme student,9069000
LG MONITOR CURVED 24 INCH 24U421A-B 27 INCH 27U421A-B VA FHD 1080P 5MS 100HZ USB-C BLACK 3Y,1399000
"Laptop ASUS GAMING V16 V3607VH Intel Core 5 210H GeForce RTX 5050 8GB RAM 16 GB SSD 512 GB Windows 11 + Office Home Student 16"" Inch WUXGA 144Hz Refresh Rate",14969000
Laptop MSI Summit A16 AI+ Touch Screen AMD Ryzen AI 9 365 RAM 32 GB SSD 1 TB Windows 11 + Office Home Student,22899000
SKYWORTH GAMING MONITOR 27 INCH H27G30Q FAST IPS QHD 2K 1440P 1MS 180HZ HDR10 3Y,2639000
"Laptop Acer Swift Go OLED SFG14 Intel Core Ultra 7 258V RAM 32 GB SSD 1 TB Windows 11 + Office Home Student 14"" WUXGA 90 Hz EVO",17399000
"Laptop Acer Swift Go OLED SFG14 Intel Core Ultra 5 226V RAM 16 GB SSD 1 TB Windows 11 + Office Home Student 14"" WUXGA 90 Hz EVO",14499000
"Laptop Acer Aspire Lite AL15 AMD Ryzen 7 8840HS RAM 16 GB SSD 512 GB Windows 11 + Office Home Student 15"" Full HD IPS",10749000
"Laptop Lenovo V14 G4 Intel Core i7 13620H RAM 16 GB SSD 512 GB Windows 11 + Office Home Student 14"" FHD IPS",10799000
"Laptop ASUS TUF FA607NUG AMD Ryzen 7 7445HS RAM 16 GB SSD 512 Gb Windows 11 + Office Home Student 15.6"" FHD+ IPS 144 Hz",15499000
"Laptop ASUS Expertbook P5405CSA Intel Core Ultra 7 258V RAM 32 GB SSD 1 TB WIndows 11 + Office Home Student 14"" WQXGA 100 Srgb",17399000
"Laptop HP 14 Intel Core i3 1315U RAM 4 GB / 8 GB SSD 512 GB WIndows 11 + Office Home Student 14"" Full HD CoPillot",6199000
"Laptop Lenovo Ideapad SLim 3 14 INtel Celeron N100 RAM 8 GB SSD 512 GB Windows 11 + Office Home Student 14"" Full HD",5049000
Motopad 60 Lite - 4GB/128GB - Helio G85 - 10.1 inch - 400nits - Dolby Atmos - 5100mAh,1799000
Motopad 60 Pro - 8GB/256GB - Dimensity 8300 - 12.7 inch - 3K 400nits 144Hz - JBL with Dolby Atmos - 10200mAh - With Moto Pen Pro,5899000
"Laptop Acer nitro V15 AMD Ryzen 7 7445HS GeForce rtx 4050 6 GB RAM 16 GB SSD 512 GB + Windows + Office HOme Student 15.6"" Full HD 180 Hz 100 SRGB",14399000
"Laptop Acer Nitro Lite 16 Core 7 240H GeForce RTX 3050 6 GB RAM 16 GB SSD 512 GB Windows 11 + Office Home Student 16"" WUXGA 180 Hz 100 Srgb",12749000
"Laptop Acer Nitro V 16S AMD Ryzen AI 9 365 GeForce RTX 5060 8 GB RAM 16 GB SSD 512 GB Windows 11 + Office Home Student 16"" WQXGA 180 Hz 100 Srgb",24999000
"Laptop Acer Nitro V 16S AMD Ryzen AI 9 365 GeForce RTX 5070 8 GB RAM 16 GB SSD 512 GB Windows 11 + Office Home Student 16"" WQXGA 180 Hz 100 Srgb",26999000
"Laptop Acer Aspire Lite AL15 AMD Ryzen 7 7730U RAM 8 GB SSD 512 GB Windows 11 + Office Home Student 15"" Full HD IPS",8119000
"Laptop Acer Aspire Go 14 AG 14 Intel Core i3 1315 RAM 8 GB / 16 GB SSD 256 gb / 512 GB Windows 11 + Office Home Student 14"" WUXGA IPS",6099000
CONSOLE PC HANDHELD ACER NITRO BLAZE 7 RYZEN 7 8840HS 16GB 512GB W11 7.0FHD 144HZ BLK,10499000
LENOVO LEGION GAMING MONITOR 25 INCH R25F-30 VA FHD 1080P 0.5MS 240HZ ERGONOMIC SPEAKER 3Y,2999000
"Laptop ASUS TUF A16 FA608UH AMD Ryzen 7 260 GeForce RTX 5050 8 GB RAM 16 GB SSD 512 GB Windows 11 + Office Home Student 16"" WUXGA 165Hz 100",18319000
Laptop Lenovo LOQ 15 Intel Core i7 13650HX RTX 4050 6 GB RAM 16 GB SSD 512 GB Windows 11 + Office Home Student 15.6 Full HD 144Hz 100 Srgb,16199000
Laptop Lenovo Loq 15 Intel Core I5 13450HX Geforce RTX 3050 6 GB RAM 16 GB SSD 512 GB Windows 11 + Office Home Student 15.6 Full HD 144Hz 100 Srgb,13199000
Laptop Lenovo LOQ 15 Intel Core i7 13650HX RTX 4060 8 GB RAM 16 GB SSD 512 GB Windows 11 + Office Home Student 15.6 Full HD 144Hz 100 Srgb,18999000
"Laptop ACER ASPIRE LITE AL15 AMD RYZEN 5 7430 RAM 8GB SSD 512GB Windows 11 + Office Home Student 15"" fhd",6899000
"Laptop HP 14 Intel Core Core 5 120U RAM 8 GB SSD 512 GB Windows 11 + Office Home Student 14"" Full HD Backlight CoPilot",8399000
"ASUS Expertcenter All In One Desktop EG3408WVAK i5 1335 RAM 8 GB / 16 GB SSD 512 GB Windows 11 23.8"" FHD",11899000
"Laptop Lenovo V15 G5 Intel COre I5 13420H RAM 8 GB SSD 512 GB Windows 11 + Office Home Student 15.6"" FUll HD IPS",8299000
"Laptop Lenovo V15 G5 Intel COre i3 1315 RAM 8 GB SSD 512 GB Windows 11 + Office HOme Student 15.6"" FUll HD IPS",6499000
"Laptop Lenovo Ideapad Slim 5 14 OLED intel Core Ultra 5 225H RAm 16GB SSD 512 GB Windows 11 + Office Home Student 14"" WUXGA",12599000
"Laptop Lenovo Ideapad Slim 5 14 OLED Intel Core Ultra 7 255H RAm 16 GB SSD 512 GB Windows 11 + Office Home Student 14"" WUXGA",14699000
"Laptop ASUS Vivobook 14 M1405YA AMD Ryzen 7 7730 RAM 16 GB SSD 1 TB WIndows 11 + Office Home Student 14"" WUXGA VIPS",10669000
"Laptop Lenovo IDEAPAD SLIM 5 OLED 14 Intel Core i5 13420H RAM 16gb SSD 512ssd W11 + OHS 14"" WUXGA BLIT 2Y + 2ADP",11099000
"HP Omnibook Ultra FLIP 14 OLED ULTRA 7 258V 32gb 1TB W11 + OHS 14"" 2.8K VRR 120HZ 2Y+ADP 2in1 EVO",25799000
"Laptop ASUS Gaming K16 K3605VC Intel COre I5 13420H RTX 3050 4GB RAM 8 GB SSD 512 GB Windows 11 + Office Home Student 16"" WUXGA",9739000
"Laptop ASUS Expertbook P5405CSA Intel COre Ultra 5 226V RAM 16 GB SSD 512 GB Windows 11 + Office Home Student 14"" WQXGA",13699000
"Laptop Acer Aspire Lite 14 AL14 Core 3 N355 RAM 8GB SSD 512 GB Windows 11 + Office Home Student 14"" inch WUXGA IPS",6049000
"Laptop Gaming Acer Predator Helios Neo OLED 16S AI Intel Core Ultra 9 275HX GeForce RTX 5070 VRAM 8 GB RAM 32 GB SSD 1 TB Windows 11 + Office Home Student 16"" WQXGA 240 Hz",35399000
Laptop HP Victus 15 AMD Ryzen 7 7445HS GeForce RTX 4050 6 GB RAm 16 GB SSD 512 GB Windows 11 + Office Home Student 15.6 Full HD 144Hz,15699000
"Laptop HP 14 AMD Ryzen 3 7320 RAM 8 GB SSD 512 Gb Windows 11 + Office Home Student 14"" Full HD IPS",5849000
Laptop ASUS TUF A15 FA506NCG AMD Ryzen 7 7445HS Geforce RTX 3050 4 GB RAM 8 GB SSD 512 GB Windows 11 + Office Home Student 15.6 Full HD 144 Hz,12149000
Laptop MSI Cyborg 15 Intel Core 5 210H GeForce RTX 5060 8 GB RAM 16 GB SSD 512 GB Windows 11 + Office Home Student 15.6 Full HD IPS 144 Hz,17099000
"Laptop Lenovo Legion 5 OLED Intel Core i7 14700HX GeForce RTX 5060 8 Gb RAM 16 GB SSD 512 GB Windows 11 + Office Home Student 15.1"" WQXGA 165Hz 24Zrgb",24719000
"Laptop Advan Workmate Intel Core i3 1215U RAm 8 GB SSD 256 Gb Windows 11 14"" WUXGA IPS",5299000
LENOVO MONITOR 22 INCH L22-4E IPS FHD 1080P 4MS 100HZ BLACK 3Y,1089000
Laptop Lenovo Thinkpad X13 G6 Intel Core Ultra 7 255U RAm 32 GB SSD 1 Tb Windows 11 Pro 13.3 WUXGA IPS 100 Srgb,29699000
Laptop Lenovo Thinkpad L13 G6 Intel Core Ultra 7 255U RAM 16 GB SSD 1 Tb Windows 11 Pro 13.3 WUXGA IPS,23999000
Laptop Lenovo Thinkpad L13 G6 Intel Core Ultra 5 225U RAm 16 GB SSD 512 GB Windows 11 Pro 13.3 WUXGA IPS,19699000
"Laptop Lenovo Legion 7 16 OLED Intel Core Ultra 9 275HX GeForce RTX5070 8 GB RAM 32 GB SSD 1 Tb Windows 11 + Office Home Student 16"" WQXGA 165Hz",37099000
"Laptop Lenovo Legion 5 15 OLED AMD Ryzen AI 7 350  GeForce RTX 5060 8 GB RAM 16 GB SSD 512 GB Windows 11 + Office Home Stduent 16"" WQXGA 165 Hz",25299000
Laptop Lenovo Legion 5 15 OLED AMD Ryzen AI 7 350 GeForce RTX 5070 8 GB RAM 32 GB SSD 1 Tb Windows 11 + Office Home Student 15.1 WQXGA 165 Hz,28999000
Laptop Lenovo Legion 5 15 OLED Intel Core Ultra 7 255HX GeForce RTX 5060 8 GB RAM 32 GB SSD 512 GB Windows 11 + Office HOme Student 15.1 WQXGA 165 Hz,26699000
"Laptop Lenovo Legion 5 15 OLED Intel Core Ultra 7 255HX GeForce RTX 5070 8 GB RAm 32 GB SSD 512 GB Windows 11 + Office Home Student 15.1"" WQXGA 165 Hz",29999000
"Laptop Lenovo Legion Pro 5 16 OLED Intel COre Ultra 8 275HX GeForce RTX 5070Ti 12 GB RAM 32 GB SSD 1 Tb WIndows 11 + Office Home Student 16"" WQXGA 240Hz",37549000
"Laptop ASUS Zenbook 14 OLED UM3406KA AMD Ryzen Ai 7 350 RAM 16 GB SSD 512 Gb Windows 11 + Office HOme Student 14""",15799000
"Laptop Gaming ASUS TUF F16 FX607VU Intel Core 5 210H GeForce RTX4050 6GB RAM 16 GB SSD 512 GB Windows 11 + Office Home Student 16"" WUXGA 165Hz 100SRGB",15899000
"Laptop Lenovo Legion Pro 5I 16 Intel COre i9 14900HX GeForce RTX 5060 8GB RAM 32 GB SSD 1 TB Windows 11 + Office Home Student 16"" WQXGA 240 HZ 100 DCIP3",28249000
"Laptop Lenovo Thinkpad T14 Gen 6 Intel Core Ultra 7 255H RAm 32 GB SSD 1 TB 14"" 2.8K Windows 11 pro",27599000
Laptop HP Victus 15 AMD Ryzen 7 7445HS GeForce RTX 3050 6 GB RAm 16 GB SSD 512 GB Windows 11 + Office Home Student 15.6 Full HD 144Hz,11599000
"Laptop Gaming HP Omen Max 16 AMD RYZEN AI 9 HX 375 RTX 5080 16 GB RAM 32 GB SSD 1 TB Windows 11 + Office Home Student 16"" WQXGA 240 Hz 100Srgb PKRGB",49099000
"Laptop HP Omen 16 AMD Ryzen AI 7 GeForce RTX 5070 8GB RAM 16 GB SSD 1 Tb Windows 11 + Office Home Student 16"" WUXGA 165Hz",30349000
"Laptop HP Omen 16 AMD Ryzen AI 9 365 GeForce RTX 5060 8GB RAM 32 GB SSD 1 Tb Windows 11 + Office Home Student 16"" WQXGA 165Hz",27599000
"Laptop HP Omen 16 AMD Ryzen AI 7 GeForce RTX 5060 8GB RAM 16 GB SSD 1 Tb Windows 11 + Office Home Student 16"" WUXGA 165Hz",22799000
"Laptop HP Omnibook 7 OLED 14 Intel COre 9 270H RAM 32 GB SSD 1 Tb Windows 11 + Office Home Student 14"" 3K 120 Hz",21999000
"Laptop HP Omnibook 5 Flip Touch Screen 14 intel Core 7 150U RAm 16 GB SSD 512 GB Windows 11 + Office Home Student 14"" 2K 2 in 1 + Pen",14499000
"Laptop HP Omnibook 5 Flip Touch Screen 14 intel Core 5 120U RAm 16 GB SSD 512 GB Windows 11 + Office Home Student 14"" 2K 2 in 1 + Pen",12649000
"Laptop HP Victus 15 AMD Ryzen AI 7 350 GeForce RTX 5060 8 GB RAM 16 GB SSD 1 TB Windows 11 + Office Home Student 15.6"" Full HD 144Hz",20399000
"Laptop HP Victus 15 AMD Ryzen AI 5 340 GeForce RTX 5060 8 GB RAM 16 GB SSD 1 TB Windows 11 + Office Home Student 15.6"" Full HD 144Hz",18849000
"Laptop HP Victus 15 AMD Ryzen 7 260 GeForce RTX 5050 8 GB RAM 16 GB SSD 512 GB Windows 11 + Office Home Student 15.6"" Full HD 144Hz",18349000
"Laptop HP Victus 15 AMD Ryzen 5 240 GeForce RTX 5050 8 GB RAM 16 GB SSD 512 GB Windows 11 + Office Home Student 15.6"" Full HD 144Hz",16799000
Laptop HP Ombibook 3 Next Gen AI AMD Ryzen AI 5 340 RAM 16 GB  SSD 512 GB Windows 11 + Office Home Student,10899000
XIAOMI REDMI 15C RAM 6 GB / 8 GB STORAGE 128 GB / 256 GB GARANSI RESMI,1695000
"ASUS All In One PC Desktop AIO P470VAK Intel Core i7 13620H RAM 16 GB SSD 512 GB WIndows 11 + Office Home Student 27"" Full HD",14149000
"Laptop HP OMEN Transcend 14 OLED Intel COre Ultra 7 255H GeForce RTX 5060 8 GB RAM 32 GB SSD 1 TB Windows 11 + Office Home Student 14"" 3K 120 Hz",31699000
LOGITECH MK250 COMPACT BLUETOOTH WIRELESS KEYBOARD AND MOUSE,409000
LOGITECH K250 COMPACT BLUETOOTH WIRELESS KEYBOARD,275000
LOGITECH M196 MOUSE WIRELESS BLUETOOTH,182000
LOGITECH H151 HEADSET STEREO MIKROFON NOISE-CANCELLING,209000
Laptop MSI Cyborg 15 Intel Core 5 210H GeForce RTX 5050 8 GB RAM 16 GB SSD 512 GB Windows 11 + Office Home Student 15.6 Full HD IPS 144 Hz,14999000
"Laptop Lenovo Legion 5 15 Intel Core i7 13650HX RTX 5050 8 GB RAM 16 gb SSD 512 GB Windows 11 + Office Home Student 15.3"" WUXGA 165Hz 100Srgb",19399000
Laptop Tecno Megabook K15S AMD Ryzen 5 7430 RAm 8 GB SSD 512 GB Windows 11 15.6 Full HD IPS,6299000
"Laptop Acer Aspire 7 Pro A715 Intel Core i7 13620H RTX 3050 6GB RAm 16 GB SSD 512 GB WIndows 11 + Office Home Student 15.6y"" Full HD 144 Hz",12399000
"Laptop Acer Nitro Lite 16 Core 5 210H GeForce RTX 3050 6 GB RAM 16 GB SSD 512 GB Windows 11 + Office Home Student 16"" WUXGA 180 Hz 100 Srgb",11499000
"Laptop Acer Nitro V 16S AMD Ryzen 5 240 GeForce RTX 5050 8 GB RAM 16 GB SSD 512 GB Windows 11 + Office Home Student 16"" WUXGA 180 Hz 100 Srgb",17299000
"Laptop Acer Nitro V16S AMD Ryzen 7 260 GeForce RTX 5050 8 GB RAM 16 GB SSD 512 GB Windows 11 + Office Home Student 16"" WUXGA 180 Hz 100 Srgb",18599000
"Laptop Acer Nitro V 16S AMD Ryzen 7 260 GeForce RTX 5060 8 GB RAM 16 GB SSD 512 GB Windows 11 + Office HOme Student 16"" WQXGA 180Hz 100 Srgb",20499000
Laptop HP Victus 15 AMD Ryzen 7 8845HS GeForce RTX 4050 6 GB RAm 8 GB SSD 512 GB Windows 11 + Office Home Student 15.6 Full HD 144Hz,15099000
"Laptop HP Omnibook X 14 Touch Screen Snapdragon X Elite X1E 78100 RAM 16 GB SSD 1 TB Windows 11 + Office Home Student 14"" 2.2K",18599000
"Laptop HP Pavilion Plus 14 OLED Intel COre i7 1355 RAM 16 GB SSD 1 Tb Windows 11 + Office Home Student 14"" 2.8K",14999000
"Laptop HP 14 Intel Core i3 1315 RAM 8 GB SSD 512 GB Windows 11 + Office Home Student 14"" FHD Blit Copilot",6499000
"Laptop Tablet ADVAN 2in1 EVO-X 13 Intel Celeron N150 RAM 12 GB SSD 512 GB Windows 11 13"" 3K IPS 100 SRGB",6299000
"Laptop Lenovo Thinkpad L13 2in1 Gen 6 Touch Screen Intel Core Ultra 7 255U RAM 16 GB SSD 1 Tb WIndows 11 Pro 13.3"" WUXGA IPS 100 Srgb + Pen",26199000
Laptop MSI Cyborg 15 Intel Core 7 240H RTX 5060 8 GB RAM 16 GB SSD 512 GB Windows 11 + Office Home Student 15.6 Full HD 144Hz,17499000
"Laptop MSI Stealth A16 Mercedes AMG AI+ AMD Ryzen AI 9 HX 370 GeForce RTX 5070 8 GB RAM 32 GB SSD 1 TB Windows 11 + Office Home Student 16"" QHD+ OLED 240 Hz",43499000
Laptop Lenovo Thinkpad X13 Gen 5 Intel Core Ultra 135U RAM 16 GB SSD 512 GB Windows 11 Pro 13.3 WUXGA 100 SRGB,23999000
"Laptop Lenovo Yoga Book 9 Intel Core Ultra 9 285H RAM 32 GB SSD 1 TB Windows 11 + office Home Student 2x 14"" 2.8K WQXGA+ OLED 120 Hz",36999000
"Laptop ASUS ROG Strix G16 G614PH AMD RYZEN 9 8940HX RTX 5050 8 Gb RAm 16 GB SSD 512 GB Windows 11 + Office Home Student 16"" WUXGA",22099000
"Laptop ASUS TUF A14 FA401UH AMD Ryzen 7 260 RTX5050 VRAM 8GB RAM 32 GB SSD 512 GB Windows 11 + Office Home Student 14"" WQXGA 165Hz 100 Srgb",22949000
"Laptop ASUS TUF FA608UP AMD Ryzen 7 260 GeForce RTX 5070 8GB RAM 16 GB SSD 1 TB Windows 11 + Office Home Student 16"" WUXGA 165Hz 100Srgb",23599000
XIAOMI MI GOOGLE TV 43 INCH A PRO QLED 4K 2026- L43MBAPID GARANSI RESMI,3739000
Laptop Acer Nitro V 15 Intel Core I7 13620H RTX 5050 8 GB RAM 16 GB SSD 512 GB Windows 11 + office Home Student 15.6 Full HD 180Hz 100Srgb,17799000
"Laptop Acer Nitro V 15 Intel Core i5 13420H RTX 5050 8GB RAm 16 GB SSD 512 GB Windows 11 + Office Home Student 15.6"" 180Hz 100 Srgb",15599000
"Laptopo Lenovo LOQ 15 Intel Core I7 13700HX GeForce RTX 5050 8GB RAM 12 GB SSD 512 GB Windows 11 + Office Home Student 15,5: Full HD",18499000
"Laptop Lenovo Legion 5i OLED Intel Core i7 14700HX GeFrce RTX5050 8Gb RAM 16 GB / 24 GB SSD 512 GB Windows 11 + Office Home Student 15,1"" WQXGA 165Hz",22999000
"Laptop Lenovo Thinkpad X1 2 in 1 Yoga G9 intel Core Ultra 7 165U RAM 32 GB SSD 1 TB Windows 11 Pro 14"" WUXGA 100Srgb",36299000
"Laptop Lenovo Thinkpad X1 Carbon G13 Touch Screen Intel Core Ultra 7 265U RAM 32 GB SSD 1 TB Windows 11 Pro 14"" WUXGA 100SrGB",38399000
"Laptop Lenovo Thinkpad X1 Carbon G13 Intel Core Ultra 7 265U RAM 32 GB SSD 1 TB Windows 11 Pro 14"" WUXGA 100SrGB",36699000
"Laptop Lenovo Thinkpad T14 G6 Intel Core Ultra 5 225H RAM 16 GB SSD 512 GB 14"" WUXGA Windows 11 Pro",23399000
"Laptop Lenovo Thinkpad E14 G6 AMD Ryzen 7 7735U RAM 16 GB SSD 1 Tb 14"" WUXGA Windows 11 Pro",18399000
"Laptop Lenovo Thinkpad E14 G6 AMD Ryzen 5 7535U RAM 8 GB SSD 512 GB 14"" WUXGA Windows 11 Pro",15099000
"Laptop Lenovo Thinkpad E14 G7 Intel COre Ultra 5 225U RAM 8 GB  SSD 512 GB  Windows 11 Pro 14"" WUXGA",17949000
LENOVO MONITOR 24 INCH L24D-4C IPS FHD 1080P 1MS 144HZ AMD FREESYNC ERGONOMIC SPEAKER USB-C,2179000
LENOVO MONITOR 27 INCH L27M-30 IPS FHD 1080P 4MS 75HZ ERGONOMIC SPEAKER USB-C 3Y,2509000
"All in One PC Desktop Lenovo AIO V100 Intel Core i3 N305 RAM 8 GB SSD 512 GB DOS / WINDOWS 11+OHS 23'8"" Full HD",7049000
Console Sony Playstation 5 Slim 1 TB Disc Version D-Chassis,9599000
"Laptop MSI Crosshair A16 HX AMD Ryzen 9 7945HX GeForce RTX 5060 8GB RAM 16 GB SSD 512 GB Windows 11 + Office Home Student 16"" QHD+ 240Hz",22299000
"Laptop MSI Crosshair A16 HX AMD Ryzen 9 7945HX GeForce RTX 5070 8 GB RAM 16 GB SSD 512 GB Windows 11 + Office Home Student 16"" QHD+ 240Hz",24399000
"Laptop Acer Aspire Lite 14 AL14 Core 3 N355 RAM 16 GB SSD 512 GB Windows 11 + Office Home Student 14"" inch WUXGA IPS",6499000
"Laptop AXIOO Pongo 775 Intel Core i7 13620H RTX 5070 8GB RAM 16 GB SSD 512 GB Windows 11 16"" QHD+ 180 Hz",21699000
"Laptop AXIOO Pongo Monster X Intel Core Ultra 275HX GeForce RTX 5090 24GB RAM 32 GB SSD 2 TB Windows 11 18"" UHD+ 240 Hz",72599000
"Laptop Acer Swift Edge 14 AI OLED Touch Screen Intel Core Ultra 7 258V RAM 32 GB SSD 1 TB Windows 11 + Office Home Student 14"" 3K 120Hz",24699000
Tablet Xiaomi Redmi Pad 2 RAM 4 GB ROM 128 GB Garansi Resmi,2029000
"Laptop ASUS Vivobook 14 A1404VAP Intel Core 5 120U RAM 16 GB SSD 512 GB Windows 11 + Office Home Student 14"" Full HD VIPS",8739000
"Laptop Gaming Acer Predator Helios Neo OLED 16S AI Intel Core Ultra 9 275HX GeForce RTX 5060 VRAM 8 GB RAM 16 GB SSD 1 TB Windows 11 + Office Home Student 16"" WQXGA 240 Hz",28799000
"Laptop MSI Katana 15HX Intel Core i9 14900HX NVidia GeForce RTX 5060 8GB RAM 16 GB SSD 512 GB Windows 11 + Office Home Student 15.6"" QHD 165Hz  2 Year",25299000
"Laptop ASUS Zenbook S16 UM5606WA Touch Screen AMD Ryzen AI 9 HX 370 RAM 32 GB SSD 1 TB Windows 11 + Office Home Student 16"" WQXGA 3K",27999000
"Laptop ASUS Vivobook 14 M1407KA AMD Ryzen AI 5 340 RAM 16 GB SSD 512 GB Windows 11 +Office Home Student 14"" WUXGA",10329000
"Laptop ASUS Expertbook P3 P3405CVA Intel Core I5 13420H RAM 8 GB SSD 512 GB Windows 11 + Office Home Student 14"" WUXGA",10549000
"Laptop Lenovo Ideapad Flex 5 14 AMD Ryzen 5 5625U RAM 16 GB SSD 512 GB Windows 11 + Office Home Student 14"" WUXGA + PEN",10449000
SAMSUNG SMART TV 32 INCH HD - LS32H5000 GARANSI RESMI,2159000
"Laptop Zyrex D-Tech Pro V1 AMD Ryzen 5 6600H RAm 16 GB SSD 512 GB Windows 11 14"" FHD IPS",6099000
"Laptop Acer Aspire Lite Al14 intel Core i5 13500H RAM 8 / 16 GB SSD 512 GB Windows 11 + Office Home Student 14"" WUXGA",8579000
"Laptop ASUS Zenbook A14 OLED Snapdragon X Elite X1E78100 RAM 32 GB SSD 512 GB WIndows 11 + Office HOme Student 14"" WUXGA",18949000
laptop Lenovo LOQ 15 intel Core i5 13450HX GeForce RTX 5050 8 GB RAM 12 GB SSD 512 GB Windows 11 + Office Home Student 15.6 FHD 144Hz 100Srgb,16399000
Laptop Gaming HP Victus 15 Intel Core I5 13420H Nvidia GeForece RTX 4050 6 GB RAM 16 GB SSD 512 GB Windows 11 + Office Home Student 15.6 Full HD IPS 144 Hz,13799000
"Laptop ASUS ROG Strix G16 G615LH Intel Core ULTRA 7 255HX GeForce RTX5050 8 GB RAM 16 GB SSD 512 GB Windows 11 + Office Home Student 16"" WQXGA 240Hz",25139000
"Laptop ASUS ROG Strix G16 G615JHR Intel Core i7 14650HX GeForce RTX5050 8 GB RAM 16 GB SSD 512 GB Windows 11 + Office Home Student 16"" WQXGA 240Hz",24299000
Laptop ASUS ROG Zephyrus G14 OLED GA403UH AMD Ryzen 9 270 GeForce RTX5050 8GB RAM 32 GB SSD 1 TB Windows 11 + Office Home Student,32599000
"Laptop ASUS GAMING V16 V3607VH Intel Core 7 240H GeForce RTX 5050 8GB RAM 16 GB SSD 512 GB Windows 11 + Office Home Student 16"" Inch WUXGA 144Hz Refresh Rate",16299000
"Laptop ASUS TUF F16 FX608JHR Intel Core i7 14650HX GeForce RTX5050 8 GB RAM 16 GB SSD 512 GB Windows 11 + Office Home Student 16"" WUXGA",21249000
"Laptop ASUS TUF F16 FX608JH Intel Core i5 13420HX GeForce RTX5050 8 GB RAM 16 GB SSD 512 GB Windows 11 + Office Home Student 16"" WUXGA",17599000
"Laptop MSI Katana 15HX Intel Core i7 14650HX NVidia GeForce RTX 5050 8GB RAM 16 GB SSD 512 GB Windows 11 + Office Home Student 15.6"" QHD 165Hz  2 Year",19999000
